-0.084764,0.0529401,0.0523543,0.0146218,-0.0874707,"Verily, [Verily: This word emphasizes the fact that, since attachment to sense objects like sound etc. and to actions is an obstacle in the path of Yoga, therefore the removal of that obstruction is the means to its attainment.] when a man who has given up thought about everything does not get attached to sense-objects or actions, he is then said to be established in Yoga."
-0.0719975,0.0264586,0.0770175,-0.0847573,-0.0608816,One should save oneself by oneself; one should not lower oneself. For oneself is verily one's own friend; oneself is verily one's own enemy.
-0.0626557,-0.0885875,0.0915883,0.0233065,0.0143268,"Of him, by whom has been conquered his very self by the self, his self is the friend of his self. But, for one who has not conquered his self, his self itself acts inimically like an enemy."
-0.0600064,0.0460008,0.0986208,-0.0624194,0.0435055,"The supreme Self of one who has control over the aggregate of his body and organs, and who is tranquil, becomes manifest. (He should be equipoised) [These words are supplied to complete the sentence.] in the midst of cold and heat, happiness and sorrow, as also honour and dishonour."
0.0286518,0.086886,-0.09388,-0.0216997,-0.0567555,"One whose mind is satisfied with knowledge and realization, who is unmoved, who has his organs under control, is said to be Self-absorbed. The yogi treats equally a lump of earth, a stone and gold."
-0.0429429,0.0627791,-0.0869192,0.0333443,0.0878627,"He excels who has sameness of view with regard to a benefactor, a friend, a foe, a neutral, an arbiter, the hateful, a relative, good people and even sinners."
-0.0987117,-0.00445673,0.0223976,-0.0346631,0.0149853,"A yogi should constantly concentrate his mind by staying in a solitary place, alone, with mind and body controlled, free from expectations, (and) free from acquisition."
0.0061907,0.0955721,-0.0861141,-0.0132197,-0.0380225,"Having firmly established in a clean place his seat, neither too high nor too low, and made of cloth, skin and kusa-grass, placed successively one below the other;"
-0.0245959,-0.00567988,-0.0230314,-0.0806927,-0.0804679,"(and) sitting on that seat, he should concentrate his mind for the purification of the internal organ, making the mind one-pointed and keeping the actions of the mind and senses under control."
-0.0784464,-0.0574059,0.0088094,0.0632333,-0.0657174,"Holding the body, head and neck erect and still, being steady, looking at the tip of his own nose-and not looking around;"
0.0731306,0.0482496,-0.0337095,-0.097012,0.00100169,"He should remain seated with a placid mind, free from fear, firm in the vow of a celibate, and with the mind fixed on Me by controlling it through concentration, having Me as the supreme Goal."
-0.00447178,0.0043624,0.0398922,0.0700563,-0.0680753,"Concentrating the mind thus for ever, the yogi of controlled mind achieves the Peace which culminates in Liberation and which abides in Me."
-0.00642088,0.0743599,-0.0661061,-0.0312964,0.0504214,"But, O Arjuna, Yoga is not for one who eats too much, nor for one who does not eat at all; neither for one who habitually sleeps too long, nor surely for one who keeps awake."
0.00409838,-0.0743453,-0.0868021,0.0940259,0.0244221,"Yoga becomes a destroyer of sorrow of one whose eating and movements are regulated, whose effort in works is moderate, and whose sleep and wakefulness are temperate."
0.0711296,0.0681089,-0.0224451,-0.00186776,0.04653,A man who has become free from hankering for all desirable objects is then said to be Self-absorbed when the controlled mind rests in the Self alone.
0.00932014,-0.0461999,-0.0539224,0.0379324,0.0756295,"As a lamp kept in a windless place does not flicker, such is the simile thought of for the yogi whose mind is under control, and who is engaged in concentration on the Self."
0.0240501,-0.07975,-0.00055183,-0.0511331,-0.0541063,"At the time when the mind restrained through the practice of Yoga gets withdrawn, and just when by seeing the Self by the self-one remains contented in the Self alone;"
0.0890787,-0.0696868,-0.0849976,-0.0880329,-0.0714167,"When one experiences that absolute Bliss which can be intuited by the intellect and which is beyond the senses, and being established (thus) this person surely does not swerve from Reality;"
0.057425,0.0380096,-0.0803709,-0.0341151,-0.00154541,"Obtaining which one does not think of any other acquisition to be superior to that, and being established in which one is not perturbed even by great sorrow;"
0.0512291,-0.0928756,-0.0138386,-0.0817862,0.0367038,One should know that severance of contact with sorrow to be what is called Yoga. That Yoga has to be practised with perseverance and with an undepressed heart.
0.078525,-0.00718574,0.0664559,0.0422164,-0.00826283,"By totally eschewing all desires which arise from thoughts, and restraining with the mind itself all the organs from every side;"
-0.0143685,0.0266997,-0.0494419,0.0920725,-0.0275457,"One should gradually withdraw with the intellect endowed with steadiness. Making the mind fixed in the Self, one should not think of anything whatsoever."
-0.0977501,-0.068352,0.0777469,0.0815813,-0.0352163,"(The yogi) should bring (this mind) under the subjugation of the Self Itself, by restraining it from all those causes whatever due to which the restless, unsteady mind wanders away."
0.0136136,-0.0969482,0.0379925,-0.0356306,0.00886373,"Supreme Bliss comes to this yogi alone whose mind has become perfectly tranquil, whose (quality of) rajas has been eliminated, who has become identified with Brahman, and is taintless."
-0.0237701,0.0523354,0.00561934,0.0508543,0.0174418,"By concentrating his mind constantly thus, the taintless yogi easily attains the absolute Bliss of contact with Brahman."
-0.00810754,-0.005304,0.0873759,0.0793543,0.0453556,"One who has his mind Self-absorbed through Yoga, and who has the vision of sameness every-where, see this Self existing in everything, and every-thing in his Self."
0.0618607,0.0224968,0.0094102,-0.0895275,0.0492975,"One who sees Me in everything, and sees all things in Me, he is never out of My sight, nor am I ever out of his sight."
-0.0126365,-0.00385385,-0.0384729,0.074,-0.0955979,"That yogi who, being established in unity, adores Me as existing in all things, he exists in Me-in whatever condition he may be."
-0.039867,0.0272848,-0.0754843,0.0286267,-0.0393002,"O Arjuna, that yogi is considered the best who judges what is happiness and sorrow in all beings by the same standard as he would apply to himself."
-0.0613306,0.0120735,-0.0958164,0.0970662,-0.0159923,"Arjuna said: O Madhusudana (Krsna), this Yoga that has been spoken of by You as sameness, I do not see its steady continuance, owing to the restlessness (of the mind)."
-0.0856987,0.00390703,0.0366828,0.053495,-0.084249,"For, O Krsna, the mind is unsteady, turbulent, strong and obstinate. I consider its control to be as greatly difficult as of the wind."
0.05548,0.00160567,0.0767486,0.0423227,0.0517336,"The Blessed Lord said: O mighty-armed one, undoubtedly the mind is intractable and restless. But, O son of Kunti, it is brought under control through practice and detachment."
-0.0590285,-0.0777338,-0.0972752,0.0457014,-0.00108984,My conviction is that Yoga is difficult to be attained by one of uncontrolled mind. But it is possible to be attained through the (above) means by one who strives and has a controlled mind.
0.0462899,0.0898397,-0.000545086,0.00449964,0.00409765,"Arjuna said: O Krsna, failing to achieve perfection in Yoga, what goal does one attain, who, though possessed of faith, is not diligent and whose mind becomes deflected from Yoga?"
0.0169298,-0.00984182,-0.0205447,-0.0585529,0.0987662,"O Mighty-armed one, fallen from both, without support, deluded on the path to Brahman, does he not get ruined like a scattered cloud?"
0.0247156,-0.0896149,0.0867211,0.00523005,-0.0970691,"O Krsna, You should totally eradicate this doubt of mine. For, none other than Yourself can be the dispeller of this doubt!"
0.00833257,-0.0665169,0.039558,0.0883901,0.0489528,"The Blessed Lord said: O Partha, there is certainly no ruin for him here or hereafter. For, no one engaged in good meets with a deplorable end, My son!"
0.0836636,-0.0902005,0.095699,-0.0812978,0.0684281,"Attaining the worlds of the righteous, and residing there for eternal years, the man fallen from Yoga is born in the house of the pious and the prosperous."
0.0159263,-0.0949842,-0.0678533,-0.00656159,-0.00252038,Or he is born in the family of wise yogis only. Such a birth as is of this kind is surely more difficult to get in the world.
0.00835133,0.031939,-0.0238136,-0.0794535,-0.0019129,"There he becomes endowed with that wisdom acquired in the previous body. and he strives more than before for perfection, O scion of the Kuru dynasty."
0.00603815,0.0981515,0.0289941,0.0253037,0.0569588,"For, by that very past practice, he is carried forward even in spite of himself! Even a seeker of Yoga transcends the result of the performance of Vedic rituals!"
0.0803315,-0.0618242,0.011525,0.0330566,-0.0427855,"However, the yogi, applying himself assiduously, becoming purified from sin and attaining perfection through many births, thereby achieves the highest Goal."
-0.0094098,0.0347614,-0.0103439,0.0296314,0.00582221,"A yogi is higher than men of austerity; he is considered higher even than men of knowledge. The yogi is also higher than men of action. Therefore, O Arjuna, you become a yogi."
-0.0825086,-0.0174001,0.025827,0.00981492,0.0293962,"Even among all the yogis, he who adores Me with his mind fixed on Me and with faith, he is considered by Me to be the best of the yogis."
-0.0034317,0.0971182,-0.0124046,0.035117,0.0802648,"The Blessed Lord said: O Partha, hear how you, having the mind fixed on Me, practising the Yoga of Meditation and taking refuge in Me, will know Me with certainty and in fullness."
0.0217973,-0.0794535,0.0457247,-0.0329458,-0.0348429,"I shall tell you in detail of this Knowledge which is combined with realization, after experiencing which there remains nothing else here to be known again."
-0.0752446,-0.0306702,-0.039048,-0.0458299,0.0357319,"Among thousands of men a rare one endeavours for perfection. Even of the perfected ones who are diligent, one perchance knows Me in truth."
-0.029505,0.071114,0.0972403,0.0346653,-0.0897305,"This Prakrti of Mine is divided eight-fold thus: earth, water, fire, air, space, mind, intellect and also egoism."
0.00835486,0.0110301,-0.0310803,0.0309343,-0.024454,"O mighty-armed one, this is the inferior (Prakrti). Know the other Prakrti of Mine which, however, is higher than this, which has taken the form of individual souls, and by which this world is upheld."
-0.0697645,-0.0124606,-0.0774855,-0.0180532,-0.0312958,Understand thus that all things (sentient and insentient) have these as their source. I am the origin as also the end of the whole Universe.
0.023644,-0.0120387,0.0189259,-0.0379463,-0.0159485,"O Dhananjaya, there is nothing else whatsoever higher than Myself. All this is strung on Me like pearls on a string."
-0.0745475,-0.0688851,0.0044114,-0.0238513,-0.0534217,"O son of Kunti, I am the taste of water, I am the effulgence of the moon and the sun; (the letter) Om in all the Vedas, the sound in space, and manhood in men."
0.0791797,-0.0491061,0.0270569,0.0721457,-0.0134146,"I am also the sweet fragrance in the earth; I am the brilliance in the fire, and the life in all beings; and I am the austerity of the ascetics."
0.0451608,-0.0755934,0.062899,-0.00519992,0.00189658,"O Partha, know Me to be the eternal Seed of all beings. I am the intellect of the intelligent, I am the courage of the courageous."
0.0904891,0.0167072,0.0133844,0.0212556,0.0501892,"And of the strong I am the strength which is devoid of passion and attachment. Among creatures I am desire which is not contrary to righteousness, O scion of the Bharata dynasty."
0.0553052,-0.0668549,0.0391157,-0.00539987,-0.0873746,"Those things that indeed are made of (the quality of) sattva, and those things that are made of (the quality of) rajas and tamas, know them to have sprung from Me alone. However, I am not in them; they are in Me!"
-0.0413233,0.0982255,-0.0241147,0.0296295,0.0339933,"All this world, deluded as it is by these three things made of the gunas (qualities), does not know Me who am transcendental to these and undecaying."
-0.0454355,-0.0693098,0.0983166,-0.0600969,-0.0780136,"Since this divine Maya of Mine which is constituted by the gunas is difficult to cross over, (therefore) those who take refuge in Me alone cross over this Maya."
-0.0230869,-0.040112,0.0114818,-0.0192317,-0.0424312,"The foolish evildoers, who are the most depraved among men, who are deprived of (their) wisdom by Maya, and who resort to demoniacal ways, do not take refuge in Me."
-0.0711975,0.01709,0.000511221,-0.0748398,0.00794332,"O Arjuna, foremost of the Bharata dynasty, four classes of people of virtuous deeds adore Me: the afflicted, the seeker of Knowledge, the seeker of wealth and the man of Knowledge."
-0.0292381,-0.0970496,-0.0942265,0.0278198,-0.0711082,"Of them, the man of Knowledge, endowed with constant steadfastness and one-pointed devotion, excels. For I am very much dear to the man of Knowledge, and he too is dear to Me."
0.0407046,0.0917476,0.0226586,0.094524,-0.0187842,"All of these, indeed, are noble, but the man of Knowledge is the very Self. (This is) My opinion. For, with a steadfast mind, he is set on the path leading to Me alone who am the super-excellent Goal."
-0.0135392,-0.0540596,0.0827438,0.024371,0.0437102,"At the end of many births the man of Knowledge attains Me, (realizing) that Vasudeva is all. Such a high-souled one is very rare."
-0.00273192,0.055367,0.0732692,0.0475243,-0.0131225,"People, deprived of their wisdom by desires for various objects and guided by their own nature, resort to other deities following the relevant methods."
-0.0356465,0.0642301,0.0144936,-0.0637188,-0.0307562,"Whichever form (of a deity) any devotee wants to worship with faith, that very firm faith of his I strengthen."
-0.0125244,-0.0613071,-0.0534639,-0.0210101,-0.00314384,"Being imbued with that faith, that person engages in worshipping that form, and he gets those very desired results therefrom as they are dispensed by Me alone."
-0.0471037,0.00761275,-0.0794146,-0.0451471,0.0747956,That result of theirs who are of poor intellect is indeed limited. The worshippers of gods go to the gods. My devotees go to Me alone.
0.0960465,0.00990438,0.0808325,-0.0755428,-0.0420003,"The unintelligent, unaware of My supreme state which is immutable and unsurpassable, think of Me as the unmanifest that has become manifest."
0.0895889,-0.0976249,0.0188463,0.0163287,0.0432024,"Being enveloped by yoga-maya, I do not become manifest to all. This deluded world does not know Me who am birthless and undecaying."
-0.081595,0.0126281,0.0738107,0.00280217,0.0379215,"O Arjuna, I know the past and the present as also the future beings; but no one knows Me!"
-0.0728721,0.00148077,-0.0208318,-0.0804642,0.0535249,"O scion of the Bharata dynasty, O destroyer of foes, due to the delusion of duality arising from likes and dislikes, all creatures become bewildered at the time of their birth."
0.0216273,0.00727159,-0.0462423,0.0527226,-0.0994075,"On the other hand, those persons who are of virtuous deeds, whose sin has come to an end, they, being free from the delusion of duality and firm in their convictions, adore Me."
-0.0710896,0.0626632,-0.0104109,-0.0450395,0.0662435,"Those who strive by resorting to Me for becoming free from old age and death, they know that Brahman, everything about the individual Self, and all about actions. [They know Brahman as being all the individual entities and all actions. This verse prescribes meditation on the qualified Brahman for aspirants of the middle class. Verses beginning with the 14th speak about the realization of the unqualified Brahman by aspirants of the highest class.]"
-0.0301891,-0.0715375,-0.0187808,0.0645109,-0.0488411,"Those who know me as existing in the physical and the divine planes, and also in the context of the sacrifice, they of concentrated minds know Me even at the time of death."
0.0268472,0.00335674,-0.0886019,-0.0935337,0.0474601,"Arjuna said: O supreme person, what is that Brahman? What is that which exists in the individual plane? What is action? And what is that which is said to exist in the physical plane? What is that which is said to be existing in the divine plane?"
-0.0281826,-0.0351107,0.0641639,-0.0232895,-0.073707,"O Madhusudana, how, and who, is the entity existing in the sacrifice here in this body? And at the time of death, how are You to be known by people of concentrated minds?"
0.097053,0.00457649,-0.0463641,0.0101269,0.0603471,The Blessed Lord said: The Immutable is the supreme Brahman; self-hood is said to be the entity present in the individual plane. By action is meant the offerings which bring about the origin of the existence of things.
0.0773609,-0.031509,0.087408,0.0849025,-0.0765396,"That which exists in the physical plane is the mutable entity, and what exists in the divine plane is the Person. O best among the embodied beings, I Myself am the entity that exists in the sacrifice in this body."
0.0685345,-0.00749849,0.0161589,-0.0909114,0.000561602,"And at the time of death, anyone who departs by giving up the body while thinking of Me alone, he attains My state. There is no doubt about this."
0.027038,0.00925592,-0.00707755,-0.0730059,0.0948634,"O son of Kunti, thinking of any entity whichever it may be one gives up the body at the end, he attains that very one, having been always engrossed in its thought."
0.0372538,-0.0789586,0.0465959,-0.0896539,0.0991718,"Therefore, think of Me at all times and fight. There is no doubt that by dedicating your mind and intellect to Me, you will attain Me alone."
0.025225,0.0388194,0.0910288,0.0866555,0.0960232,"O son of Prtha, by meditating with a mind which is engaged in the yoga of practice and which does not stray away to anything else, one reaches the supreme Person existing in the effulgent region."
0.0306041,-0.000352769,0.096319,0.0389457,0.0831219,"He who meditates on the Omniscient, the Ancient, the Ruler, subtler than the subtle, the Ordainer of everything, of inconceivable form, effulgent like the sun, and beyond darkness- (he attains the supreme Person)."
-0.043042,0.0657236,0.0347349,-0.0509625,0.0788897,"At the time of death, having fully fixed the Prana (vita force) between the eyebrows with an unswerving mind, and being imbued with devotion as also the strength of concentration, he reaches that resplendent supreme person."
0.00833278,0.0411707,0.0456637,-0.0810682,-0.0192817,"I shall speak to you briefly of that immutable Goal which the knowers of the Vedas declare, into which enter the diligent ones free from attachment, and aspiring for which people practise celibacy."
-0.0248362,0.0456724,0.00768383,0.0662685,0.000963195,"Having controlled all the passages, having confined the mind in the heart, and having fixed his own vital force in the head, (and then) continuing in the firmness in yoga;"
0.015608,-0.00467924,0.027815,-0.0205953,-0.0463056,"He who departs by leaving the body while uttering the single syllable, viz Om, which is Brahman, and thinking of Me, he attains the supreme Goal."
0.0973724,-0.0880221,-0.0290497,0.0926628,-0.00229677,"O son of Prtha, to that yogi of constant concentration and single-minded attention, who remembers Me uninterruptedly and for long, I am easy of attainment."
-0.0537272,0.00654547,0.0418178,-0.0615537,0.0337479,"As a result of reaching Me, the exalted ones who have attained the highest perfection do not get rebirth which is an abode of sorrows and which is impermanent."
0.0292877,-0.012876,0.0931513,0.0282751,0.0847745,"O Arjuna, all the worlds together with the world of Brahma are subject to return. But, O son of Kunti, there is no rebirth after reaching Me."
0.0890377,0.0737511,-0.0228457,-0.0636927,-0.0830328,"Those people who are knowers of what day and night are, know the day of Brahma which ends in a thousand yugas [The four yugas (in the human worlds), viz Satya, Treta, Dwapara, and Kali are made up of 4,320,000 years. This period multiplied by a thousand constitutes one day of Brahma. His night also extends over an equal period.], and His night which ends in a thousand yugas."
0.0623424,-0.0279165,-0.0771168,0.0434585,0.0934009,With the coming of day all manifested things emerge from the Unmanifest and when night comes they merge in that itself which is called the Unmanifested.
-0.0863464,-0.0789255,0.0812618,-0.00978514,0.0872554,"O son of Prtha, after being born again and again, that very multitude of beings disappears in spite of itself at the approach of night. It comes to life at the approach of day."
-0.0430893,0.0134384,-0.0435144,-0.0404196,-0.0960548,"But distinct from that Unmanifested is the other eternal unmainfest Reality, who does not get destroyed when all beings get destroyed."
-0.0447507,-0.0807112,-0.0352766,-0.0714158,0.0794287,"He who has been mentioned as the Unmanifested, the Immutable, they call Him the supreme Goal. That is the supreme abode of Mine, reaching which they do not return."
0.0920877,0.0526566,-0.0105622,0.0723144,0.0577763,"O son of Prtha, that supreme Person-in whom are included (all) the beings and by whom all this is pervaded-is, indeed, reached through one-pointed devotion."
-0.000210431,0.0210157,0.0422997,0.0743868,-0.0494017,"O best of the Bharata dynasty, I shall now speak of that time by departing at which the yogis attain the State of Non-return, and also (of the time by departing at which they attain) the State of Return."
0.0474586,-0.0132892,0.0700785,0.0978877,0.0444401,"Fire, light, daytime, the bright fortnight, the six months of the Northern solstice-by following this Path, persons who are knowers of Brahman attain Brahman when they die."
-0.0509961,0.0707369,0.0680794,0.0779938,-0.0529668,"Smoke, night, as also the dark fortnight and the six months of the Southern solstice-following this Path the yogi having reached the lunar light, returns."
0.091085,0.0895607,0.0338788,-0.0715688,0.0199445,"These two courses of the world, which are white and black, are verily considered eternal. By the one a man goes to the State of Non-return; by the other he returns again."
0.0495455,-0.0320972,0.0284995,-0.041093,-0.0925758,"O son of Prtha, no yogi [One steadfast in meditation.) whosoever has known these two courses becomes deluded. Therefore, O Arjuna, be you steadfast in yoga at all times."
0.0275429,-0.000568936,-0.0621667,-0.0717409,0.0501064,"Having known this, the yogi transcends all those results of righteous deeds that are declared with regard to the Vedas, sacrifices, austerities and also charities, and he reaches the primordial supreme State."
-0.0854344,0.0813265,-0.05749,-0.0136259,-0.0755441,"The Blessed Lord said: However, to you who are not given to cavilling I shall speak of this highest secret itself, which is Knowledge [Jnana may mean Brahman that is Consciousness, or Its knowledge gathered from the Vedas (paroksa-jnana). Vijnana is direct experience (aparoksa-jnana).] combined with experience, by realizing which you shall be free from evil."
-0.0858021,0.010942,0.000603071,0.0235368,-0.0425018,"This is the Sovereign Knowledge, the Sovereign Profundity, the best sanctifier; directly realizable, righteous, very easy to practise and imperishable."
0.050452,0.00605494,-0.0685827,-0.0367065,-0.0406511,"O destroyer of foes, persons who are regardless of this Dharma (knowledge of the Self) certainly go round and round, without reaching Me, along the path of transmigration which is fraught with death."
-0.0022498,-0.0479218,-0.0380751,0.0013797,-0.0469198,"This whole world is pervaded by Me in My unmanifest form. All beings exist in Me, but I am not contained in them!"
-0.0516825,-0.0835467,-0.0271592,0.021045,0.0360014,"Nor do the beings dwell in Me. Behold My Divine Yoga! I am the sustainer and originator of beings, but My Self is not contained in the beings."
0.0154472,-0.0705044,-0.0761363,0.023094,0.00411962,"Understand thus that just as the voluminous wind moving everywhere is ever present in space, similarly all beings abide in Me."
-0.0924823,0.00735115,0.0564335,0.0074257,0.0585318,"O son of Kunti, all the beings go back at the end of a cycle to My Prakrti. I project them forth again at the beginning of a cycle."
0.0210212,-0.00684242,0.0570755,0.0215891,-0.0900128,"Keeping My own Prakrti under control, I project forth again and again the whole of this multitude of beings which are powerless owing to the influence of (their own) nature."
-0.0121848,-0.0249621,0.0140396,-0.0951519,-0.0640632,"O Dhananjaya (Arjuna), nor do those actions bind Me, remaining (as I do) like one unconcerned with, and unattached to, those actions."
0.0148009,0.0220907,-0.0198875,-0.081368,-0.0543889,"Under Me as the supervisor, the Prakrti produces (the world) of the moving and the non-moving things. Owing to this reason, O son of Kunti, the world revolves."
0.00652507,0.0539986,-0.00323493,0.0165508,-0.0687303,"Not knowing My supreme nature as the Lord of all beings, foolish people disregard Me who have taken a human body."
0.0164667,0.0497953,0.0687884,-0.00872023,-0.0797263,"Of vain hopes, of vain actions, of vain knowledge, and senseless, they become verily possessed of the deceptive disposition of fiends and demons."
-0.0526579,0.0673241,-0.0311724,-0.0529322,-0.0289369,"O son of Prtha, the noble ones, being possessed of divine nature, surely adore Me with single-mindedness, knowing Me as the immutable source of all objects."
